News_Title,Article_Link,Image_URL
"Frankincense, Natural Gum Production in Ethiopia’s Amhara Region",https://newbusinessethiopia.com/agribusiness/frankincense-natural-gum-production-in-ethiopias-amhara-region/,https://newbusinessethiopia.com/wp-content/uploads/2026/06/Frankincense-Natural-Gum-Production-in-Ethiopias-Amhara-Region-144x100.gif
Ethiopia Export Earnings Surpasses $9.8 Billion,https://newbusinessethiopia.com/trade/ethiopia-export-earnings-surpasses-9-8-billion/,https://newbusinessethiopia.com/wp-content/uploads/2026/06/Ethiopia-Export-Earnings-Surpasses-9.8-Billion-150x100.jpeg
"Ethiopia’s Agricultural Investment Contributions to Export Earnings, Import Substitution",https://newbusinessethiopia.com/nbe-blog/ethiopias-agricultural-investment-contributions-to-export-earnings-import-substitution/,https://newbusinessethiopia.com/wp-content/uploads/2026/06/Ethiopias-Agricultural-Investment-Contributions-to-Export-Earnings-Import-Substitution-145x100.gif
IFC to Lend $80 Million to MIDROC Ethiopia’s Hotel Development,https://newbusinessethiopia.com/hospitality/ifc-to-lend-80-million-to-midroc-ethiopias-hotel-development/,https://newbusinessethiopia.com/wp-content/uploads/2026/06/IFC-to-Lend-80-Million-to-MIDROC-Ethiopias-Hotel-Development-174x100.gif
"Ming Yang Group to Invest $14 Billion in Solar, Wind Farm in Ethiopia",https://newbusinessethiopia.com/investment/ming-yang-group-to-invest-14-billion-in-solar-wind-farm-in-ethiopia/,https://newbusinessethiopia.com/wp-content/uploads/2026/05/Ming-Yang-Group-to-Invest-14-Billion-in-Solar-Wind-Farm-in-Ethiopia.gif
IFC to Lend $80 Million to MIDROC Ethiopia’s Hotel Development,https://newbusinessethiopia.com/hospitality/ifc-to-lend-80-million-to-midroc-ethiopias-hotel-development/,https://newbusinessethiopia.com/wp-content/uploads/2026/06/IFC-to-Lend-80-Million-to-MIDROC-Ethiopias-Hotel-Development.gif
Africa’s Critical Minerals: Strategic Opportunities and Supply Chain Risks,https://newbusinessethiopia.com/mining/africas-critical-minerals-strategic-opportunities-and-supply-chain-risks/,https://newbusinessethiopia.com/wp-content/uploads/2026/04/Africas-Critical-Minerals-Strategic-Opportunities-and-Supply-Chain-Risks.gif
Tanzania’s LNG And Supply Chain Bet,https://newbusinessethiopia.com/oil-gas/tanzanias-lng-and-supply-chain-bet/,https://newbusinessethiopia.com/wp-content/uploads/2026/04/Tanzanias-LNG-And-Supply-Chain-Bet.gif
"New Solar Power Project to Light 8,000 Households in South Ethiopia",https://newbusinessethiopia.com/energy/new-solar-power-project-to-light-8000-households-in-south-ethiopia/,https://newbusinessethiopia.com/wp-content/uploads/2026/04/77.gif
Ethiopia Amhara Region Collected 9.1 Billion Birr Tax Revenue,https://newbusinessethiopia.com/finance/ethiopia-amhara-region-collected-9-1-billion-birr-tax-revenue/,https://newbusinessethiopia.com/wp-content/uploads/2026/06/Ethiopia-Amhara-Region-Collected-9.1-Billion-Birr-Tax-Revenue.gif
Ethiopia Export Earnings Surpasses $9.8 Billion,https://newbusinessethiopia.com/trade/ethiopia-export-earnings-surpasses-9-8-billion/,https://newbusinessethiopia.com/wp-content/uploads/2026/06/Ethiopia-Export-Earnings-Surpasses-9.8-Billion.jpeg
Investor Outlook in Africa: Stability Tested by Political Shifts,https://newbusinessethiopia.com/politics/investor-outlook-in-africa-stability-tested-by-political-shifts/,https://newbusinessethiopia.com/wp-content/uploads/2026/04/Investor-Outlook-in-Africa-Stability-Tested-by-Political-Shifts.gif
Ethiopia’s Cultural Etiquette: A Journey Beyond the Surface,https://newbusinessethiopia.com/culture-tourism/ethiopias-cultural-etiquette-a-journey-beyond-the-surface/,https://newbusinessethiopia.com/wp-content/uploads/2026/05/Ethiopias-Cultural-Etiquette-A-Journey-Beyond-the-Surface.gif
"New Solar Power Project to Light 8,000 Households in South Ethiopia",https://newbusinessethiopia.com/energy/new-solar-power-project-to-light-8000-households-in-south-ethiopia/,https://newbusinessethiopia.com/wp-content/uploads/2026/04/77.gif
Entoto: The Mountain That Watches Over Addis Ababa,https://newbusinessethiopia.com/travel/entoto-the-mountain-that-watches-over-addis-ababa/,https://newbusinessethiopia.com/wp-content/uploads/2026/05/Entoto-The-Mountain-That-Watches-Over-Addis-Ababa-2-346x200.gif
"Afar Region of Ethiopia Inaugurates Bridge, Road",https://newbusinessethiopia.com/construction/afar-region-of-ethiopia-inaugurates-bridge-road/,https://newbusinessethiopia.com/wp-content/uploads/2026/05/Afar-Region-of-Ethiopia-Inaugurates-Bridge-Road.gif
"Ethiopia Inaugurates Center to Ensure Local Drugs Quality, Efficacy",https://newbusinessethiopia.com/health/ethiopia-inaugurates-center-to-ensure-local-drugs-quality-efficacy/,https://newbusinessethiopia.com/wp-content/uploads/2026/04/21.gif
"Ethiopia’s Agricultural Investment Contributions to Export Earnings, Import Substitution",https://newbusinessethiopia.com/nbe-blog/ethiopias-agricultural-investment-contributions-to-export-earnings-import-substitution/,https://newbusinessethiopia.com/wp-content/uploads/2026/06/Ethiopias-Agricultural-Investment-Contributions-to-Export-Earnings-Import-Substitution.gif
